[
  {
    "skill_id": "math.number_foundations.counting_and_quantity",
    "unit_id": "math.number_foundations",
    "title": "Counting and Quantity",
    "summary": "Understand that numbers describe how many things are in a group.",
    "objectives": [
      "Match a count to a group of objects",
      "Recognize that the last number counted is the total"
    ],
    "prerequisites": [],
    "successors": ["math.number_foundations.comparing_numbers", "math.add_sub.addition_meaning"],
    "difficulty_band": 1,
    "mastery_thresholds": {
      "understanding": 80,
      "accuracy": 85,
      "independence": 80,
      "retention": 75,
      "transfer": 70
    },
    "content_version": "0.1.0"
  },
  {
    "skill_id": "math.number_foundations.comparing_numbers",
    "unit_id": "math.number_foundations",
    "title": "Comparing Numbers",
    "summary": "Decide whether one quantity is greater than, less than, or equal to another.",
    "objectives": ["Use more, fewer, and equal to compare groups", "Read the symbols >, <, and ="],
    "prerequisites": [
      {
        "prerequisite_skill_id": "math.number_foundations.counting_and_quantity",
        "minimum_threshold": 75,
        "relationship_type": "required"
      }
    ],
    "successors": ["math.number_foundations.place_value"],
    "difficulty_band": 1,
    "mastery_thresholds": {
      "understanding": 80,
      "accuracy": 85,
      "independence": 80,
      "retention": 75,
      "transfer": 70
    },
    "content_version": "0.1.0"
  },
  {
    "skill_id": "math.number_foundations.place_value",
    "unit_id": "math.number_foundations",
    "title": "Place Value",
    "summary": "Understand that a digit's position gives it a value of ones, tens, hundreds, and so on.",
    "objectives": [
      "Identify the place of each digit in a number",
      "Write a two-digit number as tens plus ones"
    ],
    "prerequisites": [
      {
        "prerequisite_skill_id": "math.number_foundations.comparing_numbers",
        "minimum_threshold": 75,
        "relationship_type": "required"
      }
    ],
    "difficulty_band": 2,
    "mastery_thresholds": {
      "understanding": 80,
      "accuracy": 85,
      "independence": 80,
      "retention": 75,
      "transfer": 70
    },
    "content_version": "0.1.0"
  },
  {
    "skill_id": "math.add_sub.addition_meaning",
    "unit_id": "math.add_sub",
    "title": "The Meaning of Addition",
    "summary": "Understand addition as combining groups to find a total.",
    "objectives": ["Model addition as putting groups together", "Connect addition to counting on"],
    "prerequisites": [
      {
        "prerequisite_skill_id": "math.number_foundations.counting_and_quantity",
        "minimum_threshold": 75,
        "relationship_type": "required"
      }
    ],
    "difficulty_band": 1,
    "mastery_thresholds": {
      "understanding": 80,
      "accuracy": 85,
      "independence": 80,
      "retention": 75,
      "transfer": 70
    },
    "content_version": "0.1.0"
  }
]
